lp,year,title,authors,type,area,publisher,doi,url,apa
20,2020,Recommendation for the Efficient Implementation of Project Management Systemie the Metropolitan Office,"Grzegorz Kinelski, Krzysztof Zamasz, Marcin Lis","Rozdział, Redakcja",Smart City i współzarządzanie,"WSB University, Adam Marszałem",,https://wsb.edu.pl/nauka-i-badania/perfect-regionalna-inicjatywa-doskonalosci-w-akademii-wsb/wybrane-publikacje-efekty-projektu/monografia/project-management-in-public-administration-the-case-of-metropolis-gzm.html,"Kinelski, G., Zamasz, K., & Lis, M. (2020). Recommendation for the efficient implementation of project management system in the Metropolitan Office. W: K. Zamasz & K. Mucha-Kuś (red.), Project Management in Public Administration: The Case of Metropolis GZM (s. 151–163). Wydawnictwo Adam Marszałek. ISBN 978-83-8180-323-6"
22,2019,Competitivness and Efficiency Management Through Cognitive Technologies in the Digital Economy,Grzegorz Kinelski,Monografia,Gospodarka cyfrowa,Adam Marszałek,,,"Kinelski, G. (2019). Competitivness and Efficiency Management Through Cognitive Technologies in the Digital Economy. Adam Marszałek. ISBN 978-83-8180-228-4"
19,2019,Wstęp,"Grzegorz Kinelski, Joanna Marszałek-Kawa",Rozdział,Subsektor elektroenergetyczny,Adam Marszałek,,https://repozytorium.bg.ug.edu.pl/info/book/UOG89c7eee6c0874bb791391da69240292e?lang=pl,"Kinelski, G., & Marszałek-Kawa, J. (2019). Wstęp. W: J. Marszałek-Kawa & G. Kinelski (red.), Współczesne bezpieczeństwo regionu Azji i Pacyfiku: wybrane problemy (s. 5–9). Wydawnictwo Adam Marszałek. ISBN 978-83-8180-273-4"
18,2019,Zarządzxanie bezpieczeństwem energetycznym z wykorzystaniem zarządzania projektami energetycznymi w otoczeniu gospodarki cyfrowej na linii Unia Europejska - Chiny,"Grzegorz Kinelski,",Rozdział,Gospodarka cyfrowa,Adam Marszałek,,https://repozytorium.bg.ug.edu.pl/info/book/UOG89c7eee6c0874bb791391da69240292e?lang=pl,"Kinelski, G. (2019). Zarządzanie bezpieczeństwem energetycznym z wykorzystaniem zarządzania projektami energetycznymi w otoczeniu gospodarki cyfrowej na linii Unia Europejska–Chiny. W: J. Marszałek-Kawa & G. Kinelski (red.), Współczesne bezpieczeństwo regionu Azji i Pacyfiku: wybrane problemy (s. 109–159). Wydawnictwo Adam Marszałek. ISBN 978-83-8180-273-4"
17,2018,"Efektywność, jej miary, wskaźniki i ich pomiar w przedsiębiorstwach subsektora elektroenergetycznego","Grzegorz Kinelski,",Artykuł,Subsektor elektroenergetyczny,"Stowarzyszenie Elektryków Polskich Oddział Lubelski, Wydawnictwo PEKTOR",,,"Kinelski, G. (2018). Efektywność, jej miary, wskaźniki i ich pomiar w przedsiębiorstwach subsektora elektroenergetycznego. W: Rynek energii elektrycznej. REE 2018 (s. 156–170). Stowarzyszenie Elektryków Polskich Oddział Lubelski; Wydawnictwo PEKTOR. ISBN 978-83-932680-7-8"
16,2018,Centrum Usług Wspólnych jako praktyczne wdrożenie idei współdzielenia w obszarze efektywności i konkurencyjności w subsektorze elektroenergetycznym,"Grzegorz Kinelski,",Rozdział,Subsektor elektroenergetyczny,Wydawnictwo PWN,,,"Kinelski, G. (2018). Centrum usług wspólnych jako praktyczne wdrożenie idei współdzielenia w obszarze efektywności i konkurencyjności w subsektorze elektroenergetycznym. W: R. Miśkiewicz & K. Szczepańska-Woszczyna (red.), Gospodarka współdzielenia – wybrane problemy (s. 78–90). Wydawnictwo Naukowe PWN. ISBN 978-83-01-20098-5"
15,2018,"Об’єднані центри обслуговування як інноваційні організації, що підтримують ріст конкурентоспроможності підприємств"",","Grzegorz Kinelski,",Rozdział,Subsektor elektroenergetyczny,Національна академія наук України,,,"Kinelski, G. (2018). Об’єднані центри обслуговування як інноваційні організації, що підтримують ріст конкурентоспроможності підприємств. W: О. І. Амоша (ред.), Інноваційне промислове підприємство в формуванні сталого розвитку: монографія (s. 148–166). Національна академія наук України. ISBN 978-966-02-8521-7"
14,2018,Rynek dwutowarowy i istota jego konkurencyjności w sektorze elektroenergetycznym,"Grzegorz Kinelski,",Rozdział,Subsektor elektroenergetyczny,"Instytut Gospodarki Surowcami Mineralnymi i Energią Polskiej Akademii Nauk, IGSMiE PAN",,,"Kinelski, G. (2018). Rynek dwutowarowy i istota jego konkurencyjności w sektorze elektroenergetycznym. Zeszyty Naukowe Instytutu Gospodarki Surowcami Mineralnymi i Energią PAN, 102(1), 277–290. ISSN 2080-0819"
